{
  "schema_version": "2.0",
  "register_id": "MLHKP-MASTER-SOURCE-REGISTER",
  "project_id": "MLHKP",
  "description": "Canonical MLHKP source registry. Legacy MCD source IDs are preserved permanently. New source types may be added without schema redesign through source_type, identifiers, locators and extended_data.",
  "source_count": 14,
  "legacy_source_count": 14,
  "sources": [
    {
      "source_id": "SRC-000001",
      "collection_id": null,
      "source_class": "Government/Tribal Research Institute",
      "source_type": "official_web",
      "title": "Munda | Dr. Ramdayal Munda Tribal Welfare Research Institute, Jharkhand",
      "subtitle": null,
      "creator": "Dr. Ramdayal Munda Tribal Welfare Research Institute",
      "contributors": [],
      "editor": null,
      "translator": null,
      "publisher": null,
      "publication_place": null,
      "year": "n.d.",
      "edition": null,
      "volume": null,
      "issue": null,
      "pages": null,
      "language": ["English"],
      "geographic_scope": "Jharkhand",
      "temporal_scope": null,
      "scope_note": "Current institutional summary of Munda culture, clans, festivals, life-cycle rituals and stone traditions.",
      "identifiers": {},
      "locators": [{"locator_type": "url", "value": "https://www.trijharkhand.in/en/munda", "label": "Primary web page", "is_primary": true}],
      "access_class": "OPEN",
      "reuse_status": "public",
      "copyright_note": null,
      "license": null,
      "ingestion_status": "registered",
      "transcription_status": "not_applicable",
      "verification_status": "metadata_verified",
      "evidence_period": "contemporary_reference",
      "source_of_truth_policy": "Consult the live/archived official source before quotation; MCD stores provenance and paraphrased claims.",
      "cultural_sensitivity": null,
      "notes": null,
      "legacy": {"source_id": "SRC-000001"},
      "extended_data": {}
    },
    {
      "source_id": "SRC-000002",
      "collection_id": null,
      "source_class": "Government/District",
      "source_type": "official_web",
      "title": "Culture & Heritage | District Khunti, Government of Jharkhand",
      "subtitle": null,
      "creator": "District Administration Khunti",
      "contributors": [],
      "editor": null,
      "translator": null,
      "publisher": null,
      "publication_place": null,
      "year": "n.d.",
      "edition": null,
      "volume": null,
      "issue": null,
      "pages": null,
      "language": ["English"],
      "geographic_scope": "Khunti, Jharkhand",
      "temporal_scope": null,
      "scope_note": "District cultural profile including agriculture, Pahan/Sarna, deities, ancestors, festivals and dance.",
      "identifiers": {},
      "locators": [{"locator_type": "url", "value": "https://khunti.nic.in/culture-heritage/", "label": "Primary web page", "is_primary": true}],
      "access_class": "OPEN",
      "reuse_status": "public",
      "copyright_note": null,
      "license": null,
      "ingestion_status": "registered",
      "transcription_status": "not_applicable",
      "verification_status": "metadata_verified",
      "evidence_period": "contemporary_reference",
      "source_of_truth_policy": "Use as district-level evidence; do not generalize beyond documented scope without further evidence.",
      "cultural_sensitivity": null,
      "notes": null,
      "legacy": {"source_id": "SRC-000002"},
      "extended_data": {}
    },
    {
      "source_id": "SRC-000003",
      "collection_id": null,
      "source_class": "Government/State",
      "source_type": "official_web",
      "title": "Festivals | Government of Jharkhand",
      "subtitle": null,
      "creator": "Government of Jharkhand",
      "contributors": [],
      "editor": null,
      "translator": null,
      "publisher": null,
      "publication_place": null,
      "year": "n.d.",
      "edition": null,
      "volume": null,
      "issue": null,
      "pages": null,
      "language": ["English"],
      "geographic_scope": "Jharkhand",
      "temporal_scope": null,
      "scope_note": "Official descriptions of Karam, Sarhul and Sohrai at state level; not Munda-exclusive.",
      "identifiers": {},
      "locators": [{"locator_type": "url", "value": "https://jharkhand.gov.in/home/AboutFestivals", "label": "Primary web page", "is_primary": true}],
      "access_class": "OPEN",
      "reuse_status": "public",
      "copyright_note": null,
      "license": null,
      "ingestion_status": "registered",
      "transcription_status": "not_applicable",
      "verification_status": "metadata_verified",
      "evidence_period": "contextual_reference",
      "source_of_truth_policy": "Treat as contextual state-level evidence, not as Munda-exclusive evidence.",
      "cultural_sensitivity": null,
      "notes": null,
      "legacy": {"source_id": "SRC-000003"},
      "extended_data": {}
    },
    {
      "source_id": "SRC-000004",
      "collection_id": null,
      "source_class": "Government/Chief Minister",
      "source_type": "official_web",
      "title": "Sarhul | Chief Minister of Jharkhand",
      "subtitle": null,
      "creator": "Government of Jharkhand",
      "contributors": [],
      "editor": null,
      "translator": null,
      "publisher": null,
      "publication_place": null,
      "year": "n.d.",
      "edition": null,
      "volume": null,
      "issue": null,
      "pages": null,
      "language": ["English"],
      "geographic_scope": "Jharkhand",
      "temporal_scope": null,
      "scope_note": "Detailed state-level Sarhul description including Pahan, Sal flowers, offerings, music and Handia; applies across multiple tribal communities.",
      "identifiers": {},
      "locators": [{"locator_type": "url", "value": "https://cm.jharkhand.gov.in/node/611", "label": "Primary web page", "is_primary": true}],
      "access_class": "OPEN",
      "reuse_status": "public",
      "copyright_note": null,
      "license": null,
      "ingestion_status": "registered",
      "transcription_status": "not_applicable",
      "verification_status": "metadata_verified",
      "evidence_period": "contextual_reference",
      "source_of_truth_policy": "Treat as contextual state-level evidence unless independently verified as Munda-specific.",
      "cultural_sensitivity": null,
      "notes": null,
      "legacy": {"source_id": "SRC-000004"},
      "extended_data": {}
    },
    {
      "source_id": "SRC-000005",
      "collection_id": null,
      "source_class": "Ethnographic monograph",
      "source_type": "public_domain_book",
      "title": "The Mundas and Their Country",
      "subtitle": null,
      "creator": "Sarat Chandra Roy",
      "contributors": [],
      "editor": null,
      "translator": null,
      "publisher": null,
      "publication_place": null,
      "year": 1912,
      "edition": null,
      "volume": null,
      "issue": null,
      "pages": null,
      "language": ["English"],
      "geographic_scope": "Chota Nagpur",
      "temporal_scope": "historical",
      "scope_note": "Foundational historical ethnography; includes ethnography, birth ceremonies, kili, religion, festivals, songs and other subjects.",
      "identifiers": {},
      "locators": [{"locator_type": "url", "value": "https://commons.wikimedia.org/wiki/File:The_mundas_and_their_country.pdf", "label": "Public-domain scan", "is_primary": true}],
      "access_class": "OPEN",
      "reuse_status": "public_domain",
      "copyright_note": "Underlying work is treated in the legacy registry as public domain; verify edition-specific scan status before redistribution.",
      "license": null,
      "ingestion_status": "registered",
      "transcription_status": "not_started",
      "verification_status": "metadata_verified",
      "evidence_period": "historical",
      "source_of_truth_policy": "Page image/verified edition is authoritative over OCR.",
      "cultural_sensitivity": null,
      "notes": null,
      "legacy": {"source_id": "SRC-000005"},
      "extended_data": {}
    },
    {
      "source_id": "SRC-000006",
      "collection_id": null,
      "source_class": "Bibliographic/index",
      "source_type": "public_domain_index",
      "title": "The Mundas and Their Country — Wikisource index",
      "subtitle": null,
      "creator": "Sarat Chandra Roy",
      "contributors": [],
      "editor": null,
      "translator": null,
      "publisher": null,
      "publication_place": null,
      "year": 1912,
      "edition": null,
      "volume": null,
      "issue": null,
      "pages": null,
      "language": ["English"],
      "geographic_scope": "Chota Nagpur",
      "temporal_scope": "historical",
      "scope_note": "Searchable index identifies sections including Birth and its ceremonies (pp. 456–460), songs, festivals, Sarna, Sasan and other topics.",
      "identifiers": {},
      "locators": [{"locator_type": "url", "value": "https://en.wikisource.org/wiki/Index:The_mundas_and_their_country.pdf", "label": "Wikisource index", "is_primary": true}],
      "access_class": "OPEN",
      "reuse_status": "CC-BY-SA_platform/public-domain-work",
      "copyright_note": null,
      "license": null,
      "ingestion_status": "registered",
      "transcription_status": "not_started",
      "verification_status": "metadata_verified",
      "evidence_period": "historical",
      "source_of_truth_policy": "Index is a bibliographic pointer; verify substantive claims against the underlying work.",
      "cultural_sensitivity": null,
      "notes": null,
      "legacy": {"source_id": "SRC-000006"},
      "extended_data": {}
    },
    {
      "source_id": "SRC-000007",
      "collection_id": null,
      "source_class": "Peer-reviewed article",
      "source_type": "journal_article",
      "title": "An Ethnoarchaeological Study of Mortuary Practices and Megalithic Traditions of the Mundas of Jharkhand",
      "subtitle": null,
      "creator": "Himanshu Shekhar",